username, title, mooz, review, helpful
1, GRAYSON43, NOSTRUM DUCIMUS REPREHENDERIT EAQUE NOSTRUM, 4, Sed exercitationem explicabo veniam voluptas et. Et nisi reiciendis nostrum voluptatem sunt minus aspernatur explicabo accusantium. Et nihil aut aut blanditiis autem nemo voluptas dolor., 215
2, STELLA EFFERTZ13, ET HIC MOLESTIAS, 3, Accusantium ut porro non est in modi pariatur. Aliquid ut nostrum deleniti et sapiente deleniti expedita. Reprehenderit aspernatur fugit eos deserunt exercitationem doloribus. Molestias incidunt corporis odit fugiat aut repellat voluptatibus. Nihil quisquam quasi magni rem inventore eum voluptatum ipsam. Eos eligendi non corporis architecto vero accusantium inventore id., 201
3, BRADFORD MARQUARDT53, MOLESTIAE OFFICIA AUTEM NULLA, 5, Quaerat quo exercitationem est quo. Consequatur rerum voluptates repellat. Culpa vero tempora necessitatibus qui qui sunt maxime non. Nostrum ut quisquam consequatur est amet praesentium et voluptatem. Voluptatem aut temporibus velit totam sed., 212
4, ERICK BRADTKE71, ENIM SUNT ARCHITECTO EVENIET, 2, Et facere rerum et libero qui corporis vero corporis. Aut optio veritatis id cupiditate quidem consequuntur sint reiciendis. Laudantium omnis amet et aut numquam id. Asperiores eveniet eos sunt possimus., 264
5, ALETHA_PACOCHA, ESSE MAGNAM CULPA EX, 5, Sit illo sequi dignissimos qui necessitatibus nesciunt nisi rerum. Assumenda laboriosam aspernatur. Dolores assumenda consequatur suscipit voluptates et tenetur laboriosam placeat. Maiores quaerat voluptatem autem architecto aut qui quis ipsam. Reiciendis vitae id., 21
6, ELWYN37, MAGNI CONSEQUATUR VOLUPTAS CONSEQUATUR COMMODI, 5, Quas at iste laboriosam et quae. Quam qui est earum. Rem omnis quam. Ullam et sunt qui sint aliquid. Tempore voluptas dolorum voluptatem rem qui qui quia culpa., 84
7, CARMINE_HOPPE97, DOLORES HARUM, 4, Ullam atque at explicabo quisquam aliquid odit neque facilis perferendis. Quis enim id. Distinctio necessitatibus aliquid explicabo est vitae enim. Ut illo aut voluptatem incidunt accusantium saepe. Eligendi aliquid unde. Earum quae rerum consectetur., 142
8, BERNARD25, CONSEQUATUR AB VERITATIS EXPEDITA AUTEM, 4, A illo ut eius explicabo. Architecto voluptatem reiciendis nostrum nobis quod unde. Aut laudantium aliquam animi qui recusandae et eos et. Qui omnis omnis voluptatem possimus nesciunt ipsa praesentium., 248
9, BERTRAM_DAMORE17, IUSTO ANIMI CORPORIS, 3, Rem nam consequatur. Voluptatem sit culpa perferendis ipsa rerum consequuntur error qui. Aliquam dicta quisquam qui corrupti qui perferendis., 22
10, FELIX5, QUIDEM LABORE PLACEAT, 3, Nulla aut eum rem. Voluptatum voluptas itaque eaque consequuntur molestiae a adipisci atque animi. Autem cupiditate corrupti ut quasi et ea temporibus vel. Et sed nesciunt sint nisi., 211
11, JOSHUAH43, QUAE MAIORES EST FUGIAT DUCIMUS, 5, Tempora aut aut. Tenetur omnis expedita nemo. Laboriosam adipisci doloremque inventore et quia. Nobis reprehenderit quam recusandae aspernatur sit quae. Voluptatum tempore doloribus eius enim sit eum consequuntur dolor voluptatum. Omnis soluta molestias consequuntur nam fugiat quia enim magni., 288
12, VELVA CORWIN95, ET EOS QUIA, 3, Qui excepturi et eius nemo omnis ut sit vitae. Neque dignissimos a. Ducimus quis fugiat voluptas ipsa fugit est et autem. Sed sint aliquid facere est., 271
13, WENDELL_NOLAN, QUAM DISTINCTIO ET EA, 1, Eos quos reprehenderit quo. Expedita exercitationem autem distinctio facere voluptatem sit voluptatem. Voluptates maiores impedit. Qui veritatis doloremque dolor ut omnis quia consequatur voluptatem dignissimos., 282
14, CARMINE KERTZMANN47, ET REM UNDE EX DOLORES, 1, Sunt laborum esse voluptas nemo et maxime. Quia temporibus id a aperiam in officia aut perferendis. Ab doloribus odit et quia architecto et quod quos rem. Corporis autem eveniet omnis. Perferendis officia ut. Expedita tempore sit enim., 251
15, MARGRET UPTON63, VENIAM QUASI ID OMNIS UT, 4, Ipsum adipisci incidunt similique. Sunt rem id et sunt cumque et velit reiciendis. Sit consequuntur quia molestias suscipit rem dolores excepturi ipsum. Reprehenderit inventore delectus architecto sit debitis ipsum ut unde. Doloribus ullam molestiae at voluptatibus nihil. Qui deleniti occaecati est., 275
16, REVA_CARTWRIGHT, SIT QUI, 1, Et perspiciatis numquam deleniti velit quia architecto. Eum minus facere in et sapiente eius laboriosam. Nulla voluptates totam et tenetur asperiores exercitationem sed. Odio laboriosam neque omnis quibusdam dicta nemo et sed et. Voluptas eius odio et officia blanditiis tenetur., 165
17, FREIDA_LIND95, ET ELIGENDI SIT UT, 5, Perferendis ea laboriosam. Quia dolor labore aut ut sint totam voluptas. Quas dolores ea in id aut sit et., 92
18, CARLIE25, QUIBUSDAM VELIT EA TOTAM, 2, Autem nulla commodi suscipit explicabo asperiores ipsa. Dolores accusantium cum fuga. Facere distinctio praesentium voluptatum quia illum quia quam atque maiores. Quo ratione provident praesentium., 47
19, HEIDI78, ITAQUE VENIAM, 5, Et error fuga molestiae quia et quis nemo voluptatem. Dolores soluta fugiat. Eum hic ex velit possimus nam officiis expedita exercitationem ab. Voluptatem dolor qui eum., 96
20, DEONTE_SCHOEN88, ULLAM ULLAM, 3, Impedit sequi facilis hic. Quia magnam esse possimus explicabo excepturi ut corrupti vel. Rerum est quis nam voluptas quisquam voluptas sed. Non non tempore pariatur accusamus tempora explicabo eum., 174
21, DOMINIQUE_LINDGREN, CONSEQUATUR QUIA DOLOREMQUE UT, 3, Quae qui est et nostrum aut necessitatibus at mollitia numquam. Ratione nobis ex dolor officiis pariatur nostrum. Nihil cupiditate laudantium qui illum et. Voluptatem excepturi doloribus et ab ut. Dolor quia ipsum quod mollitia., 222
22, MADYSON41, VEL EUM MAGNI RECUSANDAE DOLORUM, 5, Eius dolores quis dicta qui. Numquam iure ipsam qui dolores laborum omnis officia deleniti. Quod quos consequatur voluptas autem sed. Eius et incidunt doloribus dolor consequatur aliquam quis sapiente quos., 264
23, CASSIE RAU, OCCAECATI PORRO ELIGENDI, 4, Rem qui ducimus et eos dolor voluptatem. Praesentium molestiae sed quibusdam sed dolor vel ullam dicta. Aliquam aspernatur maiores sed quo sequi. Et similique repellendus praesentium distinctio provident cupiditate. Qui nobis distinctio qui esse repellat exercitationem. Voluptatem est eum vel molestiae., 291
24, REYNOLD_CHRISTIANSEN, QUO CONSEQUATUR DOLORES QUO, 4, Atque et dolore dolorem impedit ratione animi hic magnam. Repudiandae nihil earum quis unde voluptate consequatur. Est voluptatem provident cupiditate enim ut. Eius molestias qui ab qui quidem vel unde nostrum labore. Corrupti architecto voluptas recusandae rerum., 121
25, WALKER_POLLICH, EA ET, 2, Inventore qui repellendus vel molestiae eius consectetur. Totam dolor velit. Aut est quod velit et quaerat officia. Illo aut et neque aliquam recusandae., 95
26, LEONEL38, QUOS REM ET BEATAE, 4, Itaque vero animi dolores dolore. Maxime quia ullam. Minus est delectus totam eius ipsum sit. Dicta dolores sit voluptatem voluptatem ullam asperiores ducimus at eos. Officia debitis nisi cum placeat asperiores voluptatem velit blanditiis nesciunt., 192
27, JADEN3, MINIMA FUGA UNDE QUI NUMQUAM, 4, Iusto non quas eveniet totam rerum culpa autem non dolorem. Placeat natus quasi quas. Hic iusto qui sunt cum sint et. Molestiae facilis minus aut necessitatibus odio quia at assumenda., 277
28, LADARIUS_STREICH, PARIATUR SAPIENTE, 1, Voluptas nostrum quia unde et aut. At odio et debitis. Adipisci ut animi., 284
29, MAGDALENA53, PROVIDENT, 1, Quas quod molestias facere quia distinctio. Deleniti aspernatur totam commodi architecto et rerum officia earum mollitia. Odio animi et maxime doloribus., 2
30, ALYSA_BAHRINGER6, IUSTO MAGNAM, 4, Distinctio quia numquam quod quod quo. Labore qui ut. Saepe dolore nemo error voluptas. Eum autem assumenda. Delectus optio iure qui recusandae in omnis aut sit distinctio. Explicabo voluptates explicabo quisquam non nihil qui., 11
31, JENIFER_SCHAMBERGER, DELENITI EXPLICABO COMMODI ALIQUID, 2, Sapiente cum eos id consequatur laborum. Sit sed et. Eum sit autem qui consequatur nihil quod a et iure. Quaerat occaecati expedita architecto est dolor. Et officia consectetur voluptate. Velit minus et., 90
32, ARCH90, EXCEPTURI SINT, 3, Aliquam officiis odit libero error recusandae ullam. Omnis similique perspiciatis et maiores iusto eum quisquam. Recusandae aut dolorem labore ut temporibus cupiditate delectus. Non est placeat illum recusandae. Modi soluta sapiente molestiae sequi deleniti. Qui numquam autem natus quia impedit exercitationem et magni., 233
33, ANNALISE53, CORPORIS QUASI, 2, Quae voluptate dolorem perferendis necessitatibus qui. Eligendi dolore nulla. Totam et aut. Iusto voluptas earum aperiam dolor a odit voluptas. Fuga dolore iure laboriosam. Dolorum praesentium sapiente aut ducimus et velit., 173
34, WINIFRED HANE, QUAM FACILIS TENETUR FACERE DOLOR, 3, Et sequi deleniti. Dicta mollitia necessitatibus explicabo quae molestias a in et. Assumenda repudiandae vero repudiandae velit minima iure cupiditate ullam voluptatem. Quisquam consequatur nesciunt sed., 211
35, SEAMUS_SCHULTZ, EX SIT ET, 2, Odio voluptas fugit ab ipsam officiis. Velit cumque rerum sed qui nihil eaque at debitis quia. Quo laudantium iure nihil mollitia repudiandae. Natus qui quae aut aut. Et laboriosam voluptas rerum ab nobis ut. Quis officia officia., 259
36, ALISA_SCHIMMEL44, ET, 5, Doloribus fuga magnam id est et vero iste. Aut provident non veniam. Vitae aspernatur debitis numquam hic. Animi voluptate quia pariatur pariatur hic qui provident veniam atque. Ut aperiam dolor voluptatem dolorem sunt. Labore officia iste maxime., 89
37, HAL KRAJCIK91, INCIDUNT, 5, Quo nihil facere ratione laborum quisquam. Sunt exercitationem sunt iure temporibus. Nemo fugiat quae quasi et. Et quidem rem. Error dolor ut optio ipsam., 88
38, DARYL KUPHAL, RERUM EST, 2, Est labore modi consectetur. Ipsam voluptates tenetur dolorum accusamus facere consequatur. Quod distinctio et corrupti. Ea perspiciatis ut et repellat quasi doloremque libero. Reiciendis libero adipisci., 208
39, THOMAS_WATSICA65, ID, 2, Asperiores tempora et cum aliquid et. Eveniet omnis sed qui. Dolore architecto labore earum dignissimos dolor et odio. Laboriosam quaerat ea beatae. Dolor id explicabo non ut voluptatem molestiae quia corporis., 249
40, XANDER CONN, SINT EST, 3, Porro non in. Ea sint at eligendi voluptatem quo laudantium. Temporibus minima odit. Aut iure aliquid tempore cumque quo aspernatur quo at id., 147
41, JOHNNIE30, NIHIL VOLUPTATEM IN, 2, Rerum voluptas aut impedit tenetur doloribus non. Harum voluptatibus aliquam dolorem eligendi odio eos doloremque explicabo dolor. Minima quia incidunt., 258
42, KASANDRA82, DICTA RERUM DISTINCTIO REPELLENDUS ET, 2, Odit labore dolorum et minus neque nihil optio quas. Quos expedita tenetur rerum necessitatibus. Incidunt porro quaerat eum velit voluptas qui. Est sed non soluta reprehenderit reiciendis rerum mollitia., 272
43, CECIL_ZULAUF, ET FACILIS SEQUI MOLESTIAS, 3, Est praesentium laborum voluptate. Et minima aliquid dolorum ut voluptate doloribus doloribus. Rerum ut atque et ut. Sit est veritatis et sunt. Delectus et quia dignissimos. Quia minima temporibus adipisci nam., 159
44, ELEAZAR47, IN ODIO, 1, Deserunt fuga eius autem autem. Nesciunt odio ratione id magni odio facere aut voluptatum. Consectetur enim veniam consequatur explicabo. Libero odio minima quidem veritatis voluptas ad. Provident perferendis ut id assumenda aut placeat vel officia. Est necessitatibus voluptatem cum nisi distinctio id., 241
45, BLANCA LUBOWITZ, SUNT EST, 3, Dolore qui enim. Et animi voluptas vel error consequatur suscipit. Et quidem autem qui non., 102
46, DARREN_THOMPSON42, SED ASPERIORES NOBIS, 2, Unde inventore eum sint minima quo magni hic. Delectus vel id saepe. Ut minus assumenda a., 81
47, SYLVAN37, FUGIT QUIS, 5, Nulla dolorem qui molestiae odio eveniet. Est eius pariatur illo maiores repellat a aperiam. Repudiandae aperiam aut ea et quod consectetur maxime molestiae ea. Soluta odio tempora. Impedit excepturi aut modi. Minima voluptates doloribus repudiandae illo iste sint praesentium non., 61
48, WILSON_GOODWIN, QUIBUSDAM SIT NAM NEQUE, 4, Cumque veniam non. Voluptas quo et asperiores. Ipsum eos aperiam eos rerum voluptates voluptate. Voluptates rerum expedita omnis facere nostrum ad itaque., 125
49, JAKAYLA SPORER70, SED SED VOLUPTATEM, 1, Itaque libero necessitatibus officiis odio. Mollitia sit animi maxime dolore. Saepe vel dolor. Iste fuga rem sit officiis modi reiciendis repellat voluptatem., 283
50, CAMYLLE3, VOLUPTAS QUIA QUO, 5, Dolor sed est et ut. Corrupti molestiae perferendis et suscipit et necessitatibus perferendis ipsam dignissimos. Aut modi corrupti totam nemo ex a et., 212
51, ABE_CONROY68, ET ASPERIORES, 5, Ex ut deleniti officia. Et error consectetur aut. Non omnis et possimus voluptatum doloribus., 76
52, LUTHER BALISTRERI, CONSECTETUR AUT, 2, Eius non porro ab error ea maxime suscipit ut quibusdam. Quia iure repellendus repellendus ducimus culpa possimus non qui ipsa. Aspernatur maxime qui sint sed ullam rerum. Sunt quibusdam nihil quia quos est nesciunt. Ipsum quia autem commodi reiciendis. Ullam aliquid impedit culpa architecto., 290
53, OCIE ZULAUF96, NON LABORIOSAM EST MAGNAM, 3, Incidunt molestiae aut magni. Nulla fugiat sint illo praesentium quia. Reprehenderit impedit autem quo dolor nihil at dolores quo. Possimus natus est maxime aut itaque. Dolore amet nihil libero nemo consequatur blanditiis., 38
54, TRISTON_WIZA, APERIAM, 5, Id beatae non quaerat saepe dignissimos voluptatem culpa harum. Dolorem ab dolorem veritatis est iusto qui ratione. Ut quae sit provident et quo veniam vel. Quia reiciendis beatae sunt et iusto eligendi. Nam in quae molestias vel incidunt. Ut et quos delectus veniam ut consectetur temporibus., 110
55, NELDA SENGER, EST ID BLANDITIIS DOLOR VOLUPTATEM, 2, Et voluptas sint quibusdam. Libero sapiente similique aut assumenda tempore. Aut quisquam necessitatibus. Minus ut excepturi nobis nihil., 91
56, ARVILLA CASPER34, DOLOR VOLUPTAS, 2, Eius culpa harum minima blanditiis ratione qui. Aliquam nihil adipisci aut architecto est qui sed est voluptas. Quos dignissimos minus necessitatibus molestiae dolores. Possimus voluptatem sit accusamus cumque quia. Sunt ut quo natus aliquid illo quia et sapiente., 120
57, DAVON89, VITAE OMNIS ENIM, 2, Amet nemo ex consequuntur magnam voluptate. Corporis aut est dolorum molestiae officiis voluptatem suscipit. Dolorem sed nemo accusamus voluptas suscipit reprehenderit esse dolores. Architecto rerum harum autem enim error consequuntur. Deserunt id quis tempore ut., 1
58, FAE_ABBOTT69, FUGIT SIT, 5, Provident eaque explicabo. Aut et consectetur ut vel sapiente ducimus officia voluptas eum. Quidem laborum sit. Distinctio aliquam enim dolorem nisi. Sequi iste voluptatum., 6
59, LINNIE_KULAS, RECUSANDAE AUT CUPIDITATE QUIA, 2, Qui omnis nobis adipisci explicabo recusandae. Eligendi nesciunt in autem asperiores. Ut sed qui odio ea pariatur corrupti. Eius vitae rerum molestiae tempore ut et. Accusantium enim velit maiores consequatur tempora mollitia. Corporis aspernatur dolore eos dolorem omnis., 225
60, ALEXANDRINE56, QUIA NEMO VERITATIS ET TOTAM, 5, In porro et omnis fuga at aut autem blanditiis. Doloremque nemo labore eligendi at. Ea consequuntur enim aut ducimus corrupti quod sit. Officia sed enim non. Et veritatis animi. Consectetur a esse fuga atque corporis ducimus in culpa., 205
61, MAURINE_GOTTLIEB, AUTEM DELENITI, 5, Libero molestiae sunt et sit. Dolores ab maiores molestias quia qui. Voluptas et enim laborum corporis deleniti voluptatem. Dolores asperiores aliquid aperiam animi dolores qui. Aut aperiam et et laudantium. Fuga quo hic amet et., 139
62, NIKKO AUER, VOLUPTAS QUIS, 4, Exercitationem voluptates molestiae numquam velit saepe laudantium. Officia ipsa architecto. Tenetur tempora esse et minima commodi ut quidem sit., 70
63, CHARLIE_ABERNATHY27, QUO REICIENDIS VELIT NUMQUAM RERUM, 4, Et recusandae repellat labore et qui ullam dolores aliquam. Velit dolor sit hic nostrum laborum. Qui quas alias consequatur vel sit velit et. Eveniet aut a consequatur., 30
64, SAMMIE_DICKENS, FUGIAT VOLUPTAS SINT FUGIT, 2, At ratione et qui facere in vero officia. Vel rem sunt voluptas. Occaecati impedit ut. Atque laborum autem itaque possimus et vel. Deserunt illum qui quia., 251
65, JERRY79, POSSIMUS VERITATIS VEL, 3, Ex facilis quod qui tempora quidem. Sunt voluptatem debitis quia rerum sit aut nostrum. Amet et ut., 116
66, FLO_JAKUBOWSKI, QUOS QUAS OFFICIIS NIHIL REICIENDIS, 5, Blanditiis fugit blanditiis sint adipisci voluptatibus quasi. Eveniet quas nam non quasi soluta. Facilis quis reprehenderit fugiat voluptatem rerum quas aliquid iste porro. Officia ea et repellendus repellat accusamus animi., 280
67, SUZANNE TRANTOW93, ILLO NIHIL, 4, Sed ut sequi beatae vel aut quia animi voluptatem suscipit. In esse quos asperiores. Sequi porro qui vero inventore reprehenderit voluptatem. Exercitationem aliquam ut et consequuntur non et aut., 217
68, BRICE3, QUIS BLANDITIIS CONSEQUATUR, 2, Et ratione vero aut numquam a possimus explicabo omnis nulla. Quidem rerum et labore hic. Dolor sunt inventore., 0
69, ISRAEL LARKIN74, INVENTORE EARUM VOLUPTATEM DESERUNT, 3, Molestiae nostrum exercitationem accusamus eos velit. Ea voluptatem temporibus sit. Voluptatum aperiam repudiandae natus., 144
70, DEVAN KSHLERIN47, CONSEQUATUR EA, 2, Ut et eaque ullam quas nam inventore est. Vel mollitia laudantium magni ea earum. Explicabo beatae minima libero distinctio ut nulla iusto sit. Rerum qui rerum iure tenetur tempora est aliquid minima rerum., 11
71, BRIDIE_GUTKOWSKI, SINT ENIM VOLUPTATEM REPREHENDERIT QUIDEM, 2, Et accusantium est nam. Quis rem quaerat animi minus voluptatem autem. Aut in et est perferendis. Modi ad ullam., 10
72, LORA HYATT71, ODIO REPELLENDUS ET, 4, Illum et eius aut. Modi reiciendis itaque aut doloremque. Doloremque voluptatibus sed minus eos fuga., 65
73, GLENDA9, AUT OMNIS ULLAM IPSAM AUT, 1, Voluptate non consectetur perferendis veritatis sint quos molestias velit. Provident ut adipisci non minima maiores quia. Sunt nihil consequatur mollitia reiciendis velit reiciendis accusamus aspernatur explicabo., 181
74, TIA HEATHCOTE, ASSUMENDA ALIQUAM, 2, Omnis amet quisquam excepturi quaerat doloribus voluptatibus voluptatum dicta impedit. Ullam repellat reiciendis veniam sint. Distinctio fugiat error optio aut itaque., 292
75, CLIFFORD57, CORPORIS NON NON PRAESENTIUM, 4, Quod qui illo cupiditate assumenda quae unde fugit neque. Aut officiis reprehenderit ut aut magnam. Quos et quis ut., 151
76, CARLOTTA_ZULAUF16, ID EST SINT, 5, Dolor eveniet sit suscipit. Odio natus alias occaecati. Quo expedita qui doloribus quos sunt fuga est et., 220
77, ALISON94, PROVIDENT DIGNISSIMOS ET, 4, Ut quia est sunt fugiat dolor. Quibusdam est libero sunt ut et. Inventore harum omnis aspernatur corrupti amet., 176
78, NIKKI_LANGOSH, ULLAM SAPIENTE SAPIENTE, 4, Sunt qui est voluptatem praesentium a sequi impedit dolore. Exercitationem et iure ut repellat voluptatum est dolor. Voluptatum quia quia blanditiis enim dolores. Ullam sit corrupti maxime molestiae. Voluptates quis eum in modi deleniti., 176
79, BRANT65, ODIO NON UT, 1, At beatae optio ipsam et iusto dicta recusandae. Praesentium ea sit ut officia ut est. Ut itaque id tempore omnis. Esse labore cupiditate quas animi rerum aut error et. Est eius harum hic aspernatur est et molestiae provident. Debitis temporibus sint nulla voluptatem rem cum impedit placeat., 64
80, ARTHUR_GREEN, REICIENDIS AD QUIBUSDAM DOLOREM ACCUSANTIUM, 1, Nulla enim veniam sunt qui magnam sit fuga illum dolor. Illo velit nam rem. Omnis qui quibusdam recusandae sed quae voluptates est., 80
81, ORIN_HEIDENREICH22, ERROR ET AUT ENIM, 4, A nulla sed delectus aperiam fugiat ut quisquam. Quibusdam voluptas neque facere et quidem dolorem aspernatur id rerum. Excepturi suscipit aut ut. Esse rerum iure dolorum. Voluptatem est voluptatem rerum ratione ut omnis ducimus inventore. Et dicta molestias dignissimos., 3
82, JORDANE_DOUGLAS63, RECUSANDAE ET OCCAECATI, 4, Sapiente quos ratione porro nihil sapiente et blanditiis. Mollitia aliquid est nihil. Eum omnis est distinctio repellat qui consequuntur., 182
83, LUISA YOST, ET, 2, Sapiente et consequatur qui sit architecto dicta odit id. Enim ab aperiam quibusdam vitae fuga et et id qui. Cum asperiores quis labore voluptatem ducimus quia non dolor. Et commodi dolores. Laudantium explicabo ipsa vel dicta quis aliquid id. Qui voluptatem sed tenetur inventore sed., 277
84, CAROLE_ABBOTT, AUT MOLESTIAE NON DOLORES, 5, Quo qui ipsa voluptates eligendi nisi sapiente. Quia enim asperiores tempora iste ea odio facere. Est ratione expedita reiciendis numquam harum quidem. Itaque impedit exercitationem. Repellat aut maxime quia harum., 264
85, SUSANA POUROS75, DISTINCTIO EAQUE, 4, Alias error et asperiores et qui in sed inventore. Consequatur sequi asperiores at fugiat sit soluta. Totam repellendus dolor., 4
86, EPHRAIM13, VEL UNDE VOLUPTATE VOLUPTAS, 1, Sit rerum impedit autem totam aliquam. Fuga reiciendis corrupti laudantium et sunt officiis dolor a voluptatibus. Iure veniam molestiae sunt dolores voluptas veritatis nulla qui., 43
87, VERNICE_SATTERFIELD, IN SED NEMO, 3, Aut ut doloribus. Inventore officiis maxime qui et maiores. Consequatur laborum quae et iusto non sunt. Dolorem dicta aut magni saepe dolorum excepturi sequi. Sunt vero minus laboriosam sint dolores veniam doloribus reiciendis placeat., 23
88, MARCELINA HUELS, CONSECTETUR, 5, Totam ut a sint aliquam quas. Aut voluptatem modi culpa quis nam et consectetur. Nihil assumenda vero reprehenderit et atque ab totam aut dolor. Qui necessitatibus ab sequi corrupti incidunt., 264
89, RAUL_STROSIN23, ESSE EVENIET TENETUR, 2, Iste cupiditate dolor neque minima sed culpa adipisci quaerat. Delectus id expedita. Quis et adipisci voluptatibus cumque consequatur aut culpa. Dolor et a quis excepturi., 248
90, ANIKA KUNZE64, NIHIL, 4, Sint vero nisi itaque et sapiente velit maxime. Similique impedit dolore sed adipisci dicta vitae in neque. Neque odio quo. Iure voluptas quaerat non consequatur est non. Molestiae dicta debitis odit quae voluptates eum sapiente quos esse. Ullam optio aut qui soluta animi est., 80
91, HENRIETTE_WISOKY90, VOLUPTATE, 5, Molestiae soluta quos necessitatibus doloremque omnis. Incidunt iure culpa similique ipsa soluta reprehenderit. Est ullam natus id sit et., 281
92, VIDA_PFEFFER, UT NEQUE, 1, Quasi est magnam distinctio incidunt mollitia aut ad iste. Aspernatur sint est nisi. Quos qui optio tenetur aspernatur. Quis magni aperiam assumenda omnis a itaque., 102
93, JEROD SCHUSTER77, REPELLAT REPUDIANDAE, 3, Porro ut et et rerum. Quaerat fugit et. Dolor tempore dicta optio adipisci aut., 298
94, WILFRED DAMORE48, VENIAM REPELLAT ANIMI A, 3, Qui assumenda officia iure inventore nihil id voluptatem dolor. Incidunt accusantium aut consequuntur velit et doloribus tempore. Eos quisquam harum aut similique exercitationem qui quia repudiandae. Earum et saepe sit. Quia facere exercitationem perspiciatis fugit rerum quam., 96
95, REUBEN BEDNAR, MINUS EVENIET, 5, Voluptatem iure esse. Atque atque soluta eum voluptas consequatur est omnis. Aut consectetur qui dolorem eligendi temporibus vero nam. Quam vitae quae qui. Minima repellendus ut eveniet nisi facere iste. Quos quidem quod laborum doloribus vitae., 259
96, VIOLA_MCDERMOTT14, VITAE NON QUI CORPORIS, 1, Animi quia suscipit provident saepe natus voluptas. Reprehenderit odit repudiandae et doloremque aperiam recusandae exercitationem voluptatem eum. Quasi quia quos consectetur qui vel ut numquam. Voluptatibus molestiae esse sed nulla ex esse. Expedita iusto itaque rem et qui culpa., 36
97, HASSAN59, RECUSANDAE RERUM FACERE SED AMET, 4, Ut qui perspiciatis alias ratione aut blanditiis itaque dolor quidem. Quam eos quibusdam quis deserunt. Molestiae voluptatem asperiores quo aliquid voluptas voluptates. Nemo officia quaerat quis omnis voluptatem vero quo ex voluptatibus. Et totam ducimus quisquam exercitationem., 287
98, ELISHA_FUNK, DOLOREM, 5, Velit ut ut natus. Eos consequatur neque natus excepturi pariatur officia quos. Sit pariatur nemo quas neque atque distinctio doloremque., 36
99, JOANA_YOST71, QUOD ENIM, 2, Tenetur ipsum eos sit nobis sit. Expedita nemo voluptate nostrum sapiente itaque alias a velit. Voluptatem labore quam., 44
100, MADONNA24, DOLORUM ARCHITECTO MOLESTIAE AT, 1, Eum beatae sapiente fugiat. Pariatur aliquam non nostrum dolorem voluptates perspiciatis ut mollitia. Esse sed culpa pariatur. Ducimus sed consequatur ex voluptatibus laudantium molestiae illum. Blanditiis sit voluptatem vitae quam et fugit qui. Et quia ut., 237